speaker,text
29_LARR,"But, kinda pantry area. But it's gonna be an extension of the kitchen. Kind of. So, I don't know if uh."
29_SETH,"I'd. Yeah, I'd put. I'd probably put one like right there. About right there..."
29_LARR,<NONVERBAL>
29_SETH,You gonna be putting anything there.
29_LARR,I think.
29_SETH,Probably something's gonna go there. Right. A table or something.
29_LARR,"I don't know. I, Yeah."
29_SETH,"Cause that's about the only spot you can put it. Well, I mean y- we could put a-... we could put a floor r- floor register right along here, I don't know if you'd want that. But that's probably where I'd put it. In fact the one that I was gonna put in there, I'd probably."
29_LARR,We might have trouble getting to this spot though. I think.
29_SETH,You think so.
29_LARR,"Yeah. Cause it starts getting real tight up there on this end. Yeah. Well, let's uh."
29_SETH,Maybe on this end.
29_LARR,"Yeah. It would have to be, if anywhere, it'd have to be down..."
29_SETH,<XX> that's not a bad spot.
29_LARR,Okay.
29_SETH,"It's gonna help out, cause I. See this whole area, you've just got that one grill. It's a pretty good-sized area right here."
29_LARR,Okay.
29_SETH,What about the kitchen.
29_LARR,Well let's... let's consider that.
29_SETH,Kitchen's got one.
29_LARR,Kitchen's got one right here.
29_SETH,"Yeah, okay."
29_LARR,"And uh, I'm not too worried about the kitchen. I don't like hot kitchens anyway. Cause I mean y-... you got a stove going, and. Ah we're in good shape that way... ah. Wait a minute. Did I forget something else, too. Ah yeah. We're gonna have to put a register out here. Because y-, this this wall is eventually gonna come out. And so uh."
29_SETH,Utility room.
29_LARR,"Utility room, but it's gonna eventually be part of the kitchen. And we're moving the utility room. So, and this. T-. This is a joke. N look at this..."
29_SETH,<NONVERBAL>
29_LARR,<NONVERBAL>
29_SETH,Well some of these...
29_LARR,"<XX>, Maybe maybe this doesn't make any sense, to."
29_SETH,Well some of these things you may wanna wait until you do the remodel. Like.
29_LARR,I'm th- I'm I'm wa- I'm beginning to wonder if.
29_SETH,"Because what I would prob-. What you can do, uh..."
29_LARR,<NONVERBAL>
29_SETH,Is tap right off the plenum. Cause the furnace is somewhere in that general area.
29_LARR,"It's right there, yeah."
29_SETH,"And you can just tap right off the plenum with a duct, and bring it to this room."
29_LARR,Okay. Well that's what we wanted to.
29_SETH,So that can be done.
29_LARR,That's what we wanna kn- wanna know.
29_SETH,That can be done at a later time.
29_LARR,Alright. But maybe t-.
29_SETH,That can be done at at any time.
29_LARR,Maybe for the sake of your quotation.
29_SETH,Really.
29_LARR,"You should say, this is what it's gonna cost you to put in a duct here, all these ducts, at this time."
29_SETH,Yeah. Okay.
29_LARR,"Now I don't know if... if we can price em out individually, or not."
29_SETH,"Sure. I call this what, utility r- utility room."
29_LARR,Yeah. Just pu- uh call it a.
29_SETH,Figure a duct somewhere on this wall you think.
29_LARR,Yeah. Let's just assume it'd be on this wall.
29_SETH,"Okay. Utility room kitchen, that back one we'll call that pantry."
29_LARR,"Yeah. Pantry, and then you got the dining room glass."
29_SETH,Dining room.
29_LARR,Glass dining room.
29_SETH,And then the parlor.
29_LARR,"And then the parlor, one on each end there..."
29_SETH,"Yeah. Cause we can do em now, or we can do em later. But it's not any more difficult to do em at a later time. So it's not like you have to do it now."
29_LARR,Okay.
29_SETH,"So the registers that we're connecting to, that are existing, how many of those we have got. We've got the one in the kitchen, and then we've got uh, one in the d- living room here."
29_LARR,"That guy, then there's one in the bathroom, there's one in the s study, and there is one in the library. Or in the parlor. I don't know what we'd do with that. Do we disconnect that, if we put two, or do you leave it."
29_SETH,"Uh, yeah I might disconnect that. Well it's not it's not connected up right now. So."
29_LARR,Oh that's right.
29_SETH,"So it'd just be a matter w-. Actually it sh-... it should be capped off probably though. And this is the study, one right there, and the bathroom's got one."
29_LARR,"Bathroom's got one, over by the shower there. On the floor."
29_SETH,"Okay. Okay, let me take a look downstairs again."
29_LARR,Okay.
29_SETH,<NONVERBAL>
